{
  "$schema": "https://json-schema.org/draft/2020-12/schema",
  "$id": "https://github.com/StevenJohnson998/agent-data-handling-policy/schemas/adhp-v0.2.schema.json",
  "title": "ADHP Data Handling Policy",
  "description": "Agent Data Handling Policy (ADHP) v0.2 - validates the adhp object in an agent manifest or MCP capability",
  "type": "object",
  "required": ["level"],
  "properties": {
    "level": {
      "type": "string",
      "enum": ["open", "standard", "sensitive", "strict", "zero-trace"],
      "description": "Overall data handling level (0-4)"
    },
    "training_opt_out": {
      "type": "boolean",
      "description": "Agent commits to NOT using data for model training"
    },
    "third_party_opt_out": {
      "type": "boolean",
      "description": "Agent commits to NOT sharing data with third parties"
    },
    "content_logging_opt_out": {
      "type": "boolean",
      "description": "Agent commits to NOT logging request/response content"
    },
    "output_sanitization_opt_in": {
      "type": "boolean",
      "description": "Agent commits to scrubbing outputs of source data"
    },
    "max_retention": {
      "type": "string",
      "enum": ["none", "request", "session", "24h", "7d", "30d", "custom", "unlimited"],
      "description": "Maximum data retention period"
    },
    "retention_days": {
      "type": "integer",
      "minimum": 0,
      "description": "Exact retention days when max_retention is 'custom'"
    },
    "session_ttl": {
      "type": "string",
      "enum": ["1h", "4h", "8h", "24h"],
      "description": "Session duration when max_retention is 'session'"
    },
    "delegation_policy": {
      "type": "string",
      "enum": ["none", "same_or_higher", "unrestricted"],
      "description": "Sub-agent delegation policy"
    },
    "compliance": {
      "type": "array",
      "items": { "type": "string" },
      "description": "Regulatory frameworks the agent complies with (e.g., GDPR, HIPAA)"
    },
    "pii_categories": {
      "type": "array",
      "items": {
        "type": "string",
        "enum": ["email", "phone", "financial", "health", "identity", "location", "biometric"]
      },
      "description": "PII types actively protected by the agent"
    },
    "processing_jurisdiction": {
      "type": "array",
      "items": { "type": "string", "pattern": "^[A-Z]{2}$" },
      "description": "Where the AI model runs (ISO 3166-1 alpha-2)"
    },
    "storage_jurisdiction": {
      "type": "array",
      "items": { "type": "string", "pattern": "^[A-Z]{2}$" },
      "description": "Where data is stored at rest (ISO 3166-1 alpha-2)"
    },
    "log_jurisdiction": {
      "type": "array",
      "items": { "type": "string", "pattern": "^[A-Z]{2}$" },
      "description": "Where logs are stored (ISO 3166-1 alpha-2)"
    },
    "execution_environment": {
      "type": "string",
      "enum": ["standard", "containerized", "TEE", "enclave"],
      "description": "Infrastructure type for data processing"
    },
    "certification": {
      "type": ["string", "null"],
      "description": "Verification/audit certificate ID"
    },
    "direct_marketing_opt_out": {
      "type": "boolean",
      "description": "Agent commits to NOT using data for direct marketing or commercial prospection (GDPR Art. 21)"
    },
    "scientific_usage_opt_in": {
      "type": "boolean",
      "description": "Agent declares data MAY be used for scientific research purposes (GDPR Art. 89)"
    },
    "third_party_sharing": {
      "type": "object",
      "description": "Optional detailed third-party sharing information (extended format)",
      "properties": {
        "enabled": {
          "type": "boolean",
          "description": "Whether data is shared with any third party"
        },
        "purpose": {
          "type": "array",
          "items": {
            "type": "string",
            "enum": ["analytics", "advertising", "improvement", "subprocessing", "legal", "resale"]
          },
          "description": "Why data is shared"
        },
        "sanitized": {
          "type": "boolean",
          "description": "Whether shared data is anonymized/stripped of PII"
        },
        "parties_disclosed": {
          "type": "boolean",
          "description": "Whether the list of third parties is publicly available"
        },
        "parties": {
          "type": "array",
          "items": {
            "type": "object",
            "required": ["type", "purpose"],
            "properties": {
              "name": {
                "type": "string",
                "description": "Name of the third party"
              },
              "type": {
                "type": "string",
                "enum": ["agent", "non_agent", "undisclosed"],
                "description": "Whether the third party is a registered agent"
              },
              "purpose": {
                "type": "string",
                "enum": ["analytics", "advertising", "improvement", "subprocessing", "legal", "resale"],
                "description": "Why data is shared with this party"
              },
              "adhp_level": {
                "type": ["string", "null"],
                "enum": ["open", "standard", "sensitive", "strict", "zero-trace", null],
                "description": "Third party's ADHP level if known"
              }
            }
          }
        },
        "opt_out_available": {
          "type": "boolean",
          "description": "Whether the data sender can opt out of sharing"
        }
      }
    }
  },
  "allOf": [
    {
      "if": { "properties": { "max_retention": { "const": "custom" } } },
      "then": { "required": ["retention_days"] }
    },
    {
      "if": { "properties": { "max_retention": { "const": "session" } } },
      "then": { "required": ["session_ttl"] }
    },
    {
      "if": { "properties": { "level": { "const": "zero-trace" } } },
      "then": {
        "properties": {
          "delegation_policy": { "const": "none" },
          "content_logging_opt_out": { "const": true },
          "max_retention": { "const": "none" },
          "training_opt_out": { "const": true },
          "third_party_opt_out": { "const": true },
          "direct_marketing_opt_out": { "const": true },
          "scientific_usage_opt_in": { "const": false }
        }
      }
    },
    {
      "if": { "properties": { "level": { "const": "strict" } } },
      "then": {
        "properties": {
          "content_logging_opt_out": { "const": true },
          "training_opt_out": { "const": true },
          "third_party_opt_out": { "const": true },
          "direct_marketing_opt_out": { "const": true }
        }
      }
    }
  ]
}
